{
  "$schema": "https://json-schema.org/draft/2020-12/schema",
  "$id": "https://verifrax.net/regressorium/schemas/recourse-output.schema.json",
  "title": "REGRESSORIUM Recourse Output",
  "type": "object",
  "additionalProperties": false,
  "required": [
    "object_type",
    "schema_version",
    "output_id",
    "generated_at",
    "input_class",
    "output_class",
    "status",
    "summary",
    "recourse_scope",
    "boundary_assertions",
    "basis_refs"
  ],
  "properties": {
    "object_type": { "const": "RECOURSE_OUTPUT" },
    "schema_version": {
      "type": "string",
      "pattern": "^\\d+\\.\\d+\\.\\d+$"
    },
    "output_id": { "type": "string", "minLength": 1 },
    "generated_at": { "type": "string", "format": "date-time" },
    "input_class": {
      "enum": [
        "recognition-object-reference",
        "claim-class-reference",
        "law-version-reference",
        "accepted-epoch-reference",
        "authority-object-reference",
        "execution-receipt-reference",
        "verification-result-reference",
        "operator-request"
      ]
    },
    "output_class": {
      "enum": [
        "recourse-object",
        "recourse-index-update"
      ]
    },
    "status": {
      "enum": [
        "ACTIVE_TRUTH",
        "HISTORICAL_SNAPSHOT",
        "DERIVED_PROJECTION"
      ]
    },
    "summary": { "type": "string", "minLength": 1 },
    "recourse_scope": { "type": "string", "minLength": 1 },
    "boundary_assertions": {
      "type": "object",
      "additionalProperties": false,
      "required": [
        "not-law",
        "not-state",
        "not-authority",
        "not-execution",
        "not-verification",
        "not-recognition",
        "not-proof",
        "not-intake",
        "recourse-downstream-of-recognition"
      ],
      "properties": {
        "not-law": { "const": true },
        "not-state": { "const": true },
        "not-authority": { "const": true },
        "not-execution": { "const": true },
        "not-verification": { "const": true },
        "not-recognition": { "const": true },
        "not-proof": { "const": true },
        "not-intake": { "const": true },
        "recourse-downstream-of-recognition": { "const": true }
      }
    },
    "basis_refs": {
      "type": "array",
      "minItems": 1,
      "items": { "type": "string", "minLength": 1 }
    }
  }
}
